{
  "schema": "shield.cash/evidence/v1",
  "id": "g1.relation-circuit.constraint-audit.20260723",
  "gate": "G1",
  "candidate": "g1-bn254-groth16-single-note-v0",
  "claim": "A local pre-setup audit checks the full packet relation's R1CS input incidence, public-limb parity, and systematic adversarial mutation behavior.",
  "source": {
    "repository": "/home/toorik/Projects/ZK-Proofs/shield.cash",
    "commit": "f02b3627766e6ea0627c2dcfb3e491e64f05951c",
    "dirtyPaths": [
      "evidence/G1/relation-circuit/audit/mutation-matrix.json",
      "evidence/G1/relation-circuit/audit/observation.json"
    ]
  },
  "environment": {
    "observedAt": "2026-07-23T14:11:18Z",
    "hardware": {
      "architecture": "x86_64"
    },
    "software": {
      "node": "25.9.0",
      "circom2Package": "0.2.23",
      "circomCompiler": "2.2.3",
      "circomlib": "2.0.5",
      "snarkjs": "0.7.6"
    }
  },
  "commands": [
    "npm ci --prefix circuits/g1-relation --no-audit --no-fund",
    "npm ci --prefix packages/core --no-audit --no-fund",
    "circuits/g1-relation/node_modules/.bin/circom2 circuits/g1-relation/src/g1_relation.circom --r1cs --wasm --sym --inspect -o /home/toorik/Projects/ZK-Proofs/shield-g1-artifacts/relation-low128-v0",
    "circuits/g1-relation/node_modules/.bin/snarkjs r1cs info /home/toorik/Projects/ZK-Proofs/shield-g1-artifacts/relation-low128-v0/g1_relation.r1cs",
    "npm --prefix circuits/g1-relation run generate:core-vectors -- /home/toorik/Projects/ZK-Proofs/shield-g1-artifacts/relation-low128-v0/vectors",
    "npm --prefix circuits/g1-relation run audit:constraints -- /home/toorik/Projects/ZK-Proofs/shield-g1-artifacts/relation-low128-v0 /home/toorik/Projects/ZK-Proofs/shield-g1-artifacts/relation-low128-v0/vectors /home/toorik/Projects/ZK-Proofs/shield-g1-artifacts/relation-low128-v0/audit.json"
  ],
  "artifacts": [
    {
      "path": "evidence/G1/relation-circuit/audit/mutation-matrix.json",
      "sha256": "db569ffd4b20d44fb183e7b7459089fb306ad1dd50426b8e07c96dbd98f7e434",
      "bytes": 18118
    },
    {
      "path": "circuits/g1-relation/scripts/audit-g1-relation.mjs",
      "sha256": "5591bf5206fb0e3c091df9d79bbcd2b17e617439bf759792ec9c8989526961ae",
      "bytes": 13149
    }
  ],
  "measurements": {
    "packetBytes": 752,
    "r1csConstraints": 608499,
    "wires": 603165,
    "publicInputs": 2,
    "privateInputs": 1768,
    "directInputLeaves": 1770,
    "mutationCases": 82,
    "mutationPasses": 82,
    "unexpectedAccepts": 0,
    "unexpectedRejects": 0,
    "circomInspectCA01Warnings": 2,
    "circomInspectCA02Warnings": 149
  },
  "tests": [
    {
      "name": "core deposit, transfer, and withdrawal packet limbs",
      "expected": "each is a 752-byte packet with exact two-limb SHA-256 parity",
      "observed": "all three matched",
      "pass": true
    },
    {
      "name": "R1CS/SYM public ABI and private input incidence",
      "expected": "public order Hi, Lo; no private input is both constraint-free and packet-unbound",
      "observed": "public wires 1 and 2 are Hi and Lo; no such private input found",
      "pass": true
    },
    {
      "name": "adversarial semantic mutation matrix",
      "expected": "invalid fixed-public-input changes reject; documented re-bound opaque alternatives accept",
      "observed": "79 invalid changes rejected and 3 documented alternatives accepted",
      "pass": true
    }
  ],
  "verdict": "FAIL",
  "limitations": [
    "FAIL keeps G1 open; it does not report a failure in the recorded local audit checks.",
    "No ptau, zkey, proof, verifier, BCH transaction, covenant execution, network interaction, or deployment occurred.",
    "The relation does not authenticate a raw profile manifest, validate encrypted record contents, or reconstruct and bind BCH context/script preimages.",
    "The audit samples semantic mutation families and uses direct R1CS input-wire incidence; it is not a formal proof of Poseidon/SHA soundness or absence of all circuit bugs.",
    "Sparse-nullifier collision resistance relies on the pinned hash assumptions; the duplicate-root mutation verifies the fail-closed empty-leaf condition but cannot construct a 128-bit key collision."
  ]
}
