{
  "schema": "shield.cash/evidence/v1",
  "id": "g1-pf7-ten-role-verifier-context-r1",
  "gate": "G1",
  "candidate": "BN254 PairFold-7 bounded ten-role verifier context",
  "claim": "Seven real PF7 verifier roles accept a fixed proof in a complete ten-input BCH-2026 VM context while input 7 authenticates the fixture public limbs; inputs 7-9 are explicitly structural and unevaluated.",
  "source": {
    "repository": "/tmp/verifiercash-shield-10role-019f8ed4",
    "commit": "aa12905c0f4928b20e2b66475a438eb9c7dcb613",
    "dirtyPaths": []
  },
  "environment": {
    "observedAt": "2026-07-23T17:11:58+03:00",
    "hardware": {"cpuThreads": 20, "memory": "46GiB"},
    "software": {
      "node": "v25.9.0",
      "npm": "11.12.1",
      "pnpm": "11.13.0",
      "vm": "@bitauth/libauth 3.1.0-next.8 BCH-2026",
      "cashc": "vendored 1c707c1dbf87396b30ba5e0704b1db44475ce893",
      "leanbch": "51201015fdaef4562debf2a2b1cab4013a45e8b4"
    }
  },
  "commands": [
    "See commands.txt; direct PF7 profile-equivalent C7 build with C7_STRUCTURAL_ROLE_COUNT=3.",
    "run-input-redteam.ts against honest and independently rebuilt off-subgroup ten-input contexts."
  ],
  "artifacts": [
    {"path": "evidence/G1/verifier-ten-role/raw/build-result.json", "sha256": "25c820b77e0ba871426087f2a63e3905053debd7eb0d00ad3bb3f466d11d5238", "bytes": 2982},
    {"path": "evidence/G1/verifier-ten-role/raw/inputs_dump.json", "sha256": "3c9e2426540eca97094b20e6247aae9f85c0821bb778536415bef5a581eb4bae", "bytes": 109510},
    {"path": "evidence/G1/verifier-ten-role/raw/candidate-tx.hex", "sha256": "2725394ddd7e25b2936277929d01415bfb66ef59102b5f9ea00329ba1c16cc05", "bytes": 109122},
    {"path": "evidence/G1/verifier-ten-role/raw/source-outputs.hex", "sha256": "d20d44cfa558b50d1c16dc013af3cfe99fa29946bddecebed41cb2b6a187448a", "bytes": 822},
    {"path": "evidence/G1/verifier-ten-role/raw/op-margin.json", "sha256": "a7970e789b2229cb1b30bd40d07f619778ad801bdd866c4cb92a0403251cb6af", "bytes": 53},
    {"path": "evidence/G1/verifier-ten-role/raw/boundary-parts.json", "sha256": "0f6639e5745824c1a73deede0e20cc63c16281968e78e9a64bbc28f6acd00c4c", "bytes": 819},
    {"path": "evidence/G1/verifier-ten-role/raw/input-redteam.json", "sha256": "e54bcbf8f82619c99b098e8ed250bdb7a24a88b1b42a18797c0123eececa7e1b", "bytes": 16880},
    {"path": "evidence/G1/verifier-ten-role/raw/vectors.json", "sha256": "9af75ae6b665512be654a4f4dabce5d3cfc3338ac1b42b3051b736ba89d0f81f", "bytes": 1537290},
    {"path": "evidence/G1/verifier-ten-role/leanbch-xcheck.json", "sha256": "d90816ac80b29f437d2d9627ce3e0b66fa048c87f770320b6a0d7d5b981f4aad", "bytes": 3933},
    {"path": "evidence/G1/verifier-ten-role/raw/leanbch-xcheck-native-results.tsv", "sha256": "f76673b7100aa29a5ce08de89e9ecb074d88ef47be61cd9b56bc2eda46ad735d", "bytes": 1001}
  ],
  "measurements": {
    "inputCount": 10,
    "verifierInputCount": 7,
    "structuralRoleCount": 3,
    "structuralRolesUnevaluated": true,
    "packet": {"input": 7, "format": "SHP1||in0_be32||in1_be32", "bytes": 68, "unlockBytes": 69, "sha256": "be01fcef0d940d66b113d89da3b602b92cd06ee3a6d4547b6ac0aea69836b5ca"},
    "sourceLockBytes": 320,
    "unlockBytes": 54117,
    "wireBytes": 54561,
    "structuralScoreBytes": 54881,
    "maxVerifierUnlockBytes": 9249,
    "maxVerifierUnlockMarginTo9500": 251,
    "verifierVmAccepts": "7/7"
  },
  "tests": [
    {"name": "valid seven-role verifier context", "expected": "7/7 accepts", "observed": "7/7 accepts", "pass": true},
    {"name": "off-subgroup trajectory", "expected": "terminal rejects", "observed": "terminal rejects", "pass": true},
    {"name": "proof/public-limb/packet mutations", "expected": "at least one verifier role rejects", "observed": "all listed mutations reject", "pass": true},
    {"name": "harness typecheck", "expected": "pass", "observed": "pass", "pass": true},
    {"name": "repository architecture suite", "expected": "pass", "observed": "7 unrelated checkout-layout failures", "pass": false}
  ],
  "verdict": "FAIL",
  "limitations": [
    "FAIL keeps G1 open; the seven-role VM result passes only the bounded verifier-context milestone described in the report.",
    "Not a valid ten-input BCH transaction: packet/state/fee roles are structural and unevaluated.",
    "No binding covenant, state covenant, fee policy, canonical protocol outputs, BCHN standardness, or Chipnet result. The separately recorded LeanBCH xcheck covers only verifier inputs 0..6 with Crypto.Secp256k1.reject; roles 7..9 remain unevaluated.",
    "Packet is authenticated against the fixture public limbs, not a complete runtime action-packet parser.",
    "The repository-wide architecture suite is not green in this linked worktree because historical candidate files are absent and arena lifecycle tests require a primary checkout."
  ]
}
