{
  "schema": "shield.cash/evidence/v1",
  "id": "g1.verifier-envelope.pf7-ten-input-context.20260723",
  "gate": "G1",
  "candidate": "bn254-onetx-pf7-sub62-r1-plus-three-structural-inputs",
  "claim": "The existing seven-role PF7 verifier cluster does not remain valid when three structural inputs are appended to form a ten-input transaction context.",
  "source": {
    "repository": "/home/toorik/Projects/ZK-Proofs/verifier.cash",
    "commit": "26468ae29004d2401619032de2a6ec8de269a4d6",
    "dirtyPaths": []
  },
  "environment": {
    "observedAt": "2026-07-23T16:57:00+03:00",
    "hardware": {
      "architecture": "x86_64"
    },
    "software": {
      "node": "v25.9.0",
      "libauth": "3.1.0-next.8",
      "bch": "BCH-2026"
    }
  },
  "commands": [
    "harness/node_modules/.bin/tsx evidence/G1/verifier-envelope-integration/probe-10input-context.mjs <verifier-root> <pf7-build-dir>"
  ],
  "artifacts": [
    {
      "path": "evidence/G1/verifier-envelope-integration/REPORT.md",
      "sha256": "f66219851aa6235c657d46f84f8c540e9a5bb91b0b3d70287b351fb8f83abcfd",
      "bytes": 6922
    },
    {
      "path": "evidence/G1/verifier-envelope-integration/ten-input-context-result.json",
      "sha256": "9bf053a21ff21d877da024762fca8a9b0967c9dfa8fe4476bd6458239a3079c7",
      "bytes": 1491
    },
    {
      "path": "evidence/G1/verifier-envelope-integration/probe-10input-context.mjs",
      "sha256": "1b120e58bebc697967ee1da729069bec3f61a261bb739eed8b70b0542aa85221",
      "bytes": 3658
    }
  ],
  "measurements": {
    "verifierInputs": 7,
    "expandedInputs": 10,
    "structuralWireBytes": 54419,
    "acceptingVerifierRoles": 6,
    "rejectingVerifierRoles": 1,
    "rejectingRole": "terminal",
    "terminalOperationCost": 7147893
  },
  "tests": [
    {
      "name": "existing PF7 verifier roles accept in a ten-input context",
      "expected": "7 of 7 verifier roles accept",
      "observed": "6 of 7 accept; terminal rejects at OP_VERIFY",
      "pass": false
    }
  ],
  "verdict": "FAIL",
  "limitations": [
    "The three appended inputs are structural P2PKH records, not implemented binding, state, or fee roles.",
    "The result rejects reuse of the existing PF7 scripts by appending inputs; it does not prove a newly generated ten-role verifier topology infeasible.",
    "No action packet, new circuit proof, state covenant, standard complete action, BCHN peer, Chipnet transaction, or deployment was tested."
  ]
}
