{
  "schema": "shield.cash/evidence/v1",
  "id": "g1.prover-artifact-budget.development-v0.20260723",
  "gate": "G1",
  "candidate": "g1-bn254-groth16-single-note-v0",
  "claim": "The real development-v0 Groth16 proving key and witness-generator WASM fit the frozen 512 MiB compressed profile-artifact ceiling, and independent streaming decompression reproduced both supplied source identities.",
  "source": {
    "repository": "/home/toorik/Projects/ZK-Proofs/shield.cash",
    "commit": "d5fd0dbd05a59742f43854cc5532f470bf92e6b9",
    "dirtyPaths": [
      "evidence/G1/prover-artifact-budget/REPORT.md",
      "evidence/G1/prover-artifact-budget/observation.json"
    ]
  },
  "environment": {
    "observedAt": "2026-07-23T15:06:32Z",
    "hardware": {
      "architecture": "x86_64"
    },
    "software": {
      "node": "25.9.0",
      "zstd": "1.5.7",
      "zstdSha256": "6b799c822798547e33f3d928d04492ca4814d4b45088786b73d700f0cc0d905a"
    }
  },
  "commands": [
    "node packages/prover-artifact-budget/cli.mjs --input /home/toorik/Projects/ZK-Proofs/shield-g1-artifacts/prover-artifacts-low128-v0.input.json",
    "/usr/bin/zstd -d -q --no-progress -c /home/toorik/Projects/ZK-Proofs/shield-g1-artifacts/prover-artifacts-low128-v0/final.zkey.zst | sha256sum",
    "/usr/bin/zstd -d -q --no-progress -c /home/toorik/Projects/ZK-Proofs/shield-g1-artifacts/prover-artifacts-low128-v0/final.zkey.zst | wc -c",
    "/usr/bin/zstd -d -q --no-progress -c /home/toorik/Projects/ZK-Proofs/shield-g1-artifacts/prover-artifacts-low128-v0/witness-generator.wasm.zst | sha256sum",
    "/usr/bin/zstd -d -q --no-progress -c /home/toorik/Projects/ZK-Proofs/shield-g1-artifacts/prover-artifacts-low128-v0/witness-generator.wasm.zst | wc -c"
  ],
  "artifacts": [
    {
      "path": "evidence/G1/prover-artifact-budget/REPORT.md",
      "sha256": "48c577b68dc50244b70a567e75d4d7144fe37cfe4ca2a6bba46ad23944e5cf94",
      "bytes": 2300
    }
  ],
  "measurements": {
    "compressedLimitBytes": 536870912,
    "totalRawBytes": 331558871,
    "totalCompressedBytes": 170577395,
    "remainingBudgetBytes": 366293517,
    "budgetUsePercent": 31.77251573652029,
    "observablePackagingSeconds": 102.854900445,
    "compressionArgv": [
      "-q",
      "--no-progress",
      "-T1",
      "-19",
      "--no-check"
    ]
  },
  "tests": [
    {
      "name": "fixed compressed profile-artifact budget",
      "expected": "total compressed bytes <= 536870912",
      "observed": 170577395,
      "pass": true
    },
    {
      "name": "independent zkey round trip",
      "expected": "321581772 bytes and sha256 37a7ee2fe9e7ee1e2583d60e0e52d86360d7c7a7be5b23dbb0cc166bb5905453",
      "observed": "321581772 bytes and sha256 37a7ee2fe9e7ee1e2583d60e0e52d86360d7c7a7be5b23dbb0cc166bb5905453",
      "pass": true
    },
    {
      "name": "independent WASM round trip",
      "expected": "9977099 bytes and sha256 1332f89bf4287fc51d7a6f4fd86acb45511a3aaf4ccd4859c6aecda4dd4b3b57",
      "observed": "9977099 bytes and sha256 1332f89bf4287fc51d7a6f4fd86acb45511a3aaf4ccd4859c6aecda4dd4b3b57",
      "pass": true
    }
  ],
  "verdict": "FAIL",
  "limitations": [
    "FAIL keeps the full G1 gate open; the recorded artifact-size subrequirement passes.",
    "This record does not measure witness generation, proving, verification, browser memory, Android memory, transaction size, or BCH VM behavior.",
    "The setup and artifacts are permanently development-only and are not multi-party-ceremony or production evidence.",
    "The packaging interval is derived from filesystem timestamps because the original terminal wrapper yielded before returning its elapsed counter."
  ]
}
