{
  "schema": "shield.cash/evidence/v1",
  "id": "g1.bn254-onetx-pf7-sub62-partition",
  "gate": "G1",
  "candidate": "bn254-onetx-pf7-sub62-r1",
  "claim": "A real seven-input PairFold topology reproduces with every unlocking script at or below 9,500 bytes while retaining runtime proof binding and a complete real-VM/adversarial corpus.",
  "source": {
    "repository": "/home/toorik/Projects/ZK-Proofs/verifier.cash",
    "commit": "26468ae29004d2401619032de2a6ec8de269a4d6",
    "dirtyPaths": []
  },
  "environment": {
    "observedAt": "2026-07-23T16:42:55+03:00",
    "hardware": {"kernel": "Linux 7.1.3-arch1-2 x86_64"},
    "software": {"node": "v25.9.0", "npm": "11.12.1", "pnpm": "10.12.2", "cashc": "1c707c1dbf87396b30ba5e0704b1db44475ce893", "libauth": "3.1.0-next.8", "leanbch": "51201015fdaef4562debf2a2b1cab4013a45e8b4", "bch": "BCH-2026"}
  },
  "commands": [
    "npm ci --no-audit --no-fund",
    "cd harness && corepack pnpm install --frozen-lockfile",
    "cd build && corepack pnpm install --frozen-lockfile",
    "LEANBCH_ROOT=<pinned-leanbch-temp> npm run vc -- build lanes/bn254-onetx/candidates/bn254-onetx-pf7-sub62-r1.json --run-id g1-pf7-sub62"
  ],
  "artifacts": [
    {"path": "evidence/G1/verifier-partition/hashes.txt", "sha256": "765e2b5e4696b37029a0ca754bc7476c764272ea39663db5cc8820b529a85987", "bytes": 905}
  ],
  "measurements": {
    "allBytesScore": 54541,
    "wireBytes": 54296,
    "scoreComponents": {"unlockingBytes": 53975, "sourceLockingBytes": 245, "wireOverheadBytes": 321},
    "perInputUnlockingBytes": [8177, 6654, 7066, 7066, 8393, 7443, 9176],
    "maxUnlockingBytes": 9176,
    "marginTo9500": 324,
    "marginTo10000": 824,
    "inputCount": 7,
    "sourceLocks": {"count": 7, "bytesEach": 35, "valueSatoshisEach": 1000},
    "fixtureFeeSatoshis": 6000,
    "operationCost": 5667649,
    "operationBudget": 5987200,
    "operationMargin": 319551,
    "canonicalManifestSha256": "8066cfd98936564912f67cd99e33a4346a22f89db64544d4e51bb024a2a5a8ce",
    "rawCandidateFileSha256": "c03e8ae157998f513f058433e58e3252e05a2d2c39f5577a992d39c9daf3ff19",
    "resultSha256": "e5e13c7ac614c8a48b1eebb0ee3a5a4a4c5e82a5d08e9d1ebdada6841b68d307",
    "transactionHexSha256": "b86886291035a4e8bafea8e9f8eb6cb86dea52ad1e67853b0316480f3abafdf4"
  },
  "tests": [
    {"name": "primary real VM inputs", "expected": "7 accepts and no filler", "observed": "7/7 accepts; all looksFiller=false", "pass": true},
    {"name": "frozen per-input ceiling", "expected": "every unlocking script <=9500", "observed": "max 9176; margin 324", "pass": true},
    {"name": "adversarial corpus", "expected": "valid variants accept; invalid curve variants reject", "observed": "21/21 extra-valid accept; off-curve A/B each 7/7 reject; off-subgroup terminal rejects", "pass": true},
    {"name": "worst-case proof", "expected": "all inputs accept", "observed": "7/7 accept", "pass": true}
  ],
  "verdict": "PASS",
  "limitations": [
    "PASS is partition qualification only, not G1 PASS or any production/release claim.",
    "The candidate uses fixed verifier/deployment material and is not a ceremony-backed shield.cash verifier bundle.",
    "The fixture fee is 6,000 satoshis and is not default-fee peer-relay evidence.",
    "The complete shield.cash settlement envelope and current BCH peer behavior remain unmeasured.",
    "Candidate manifest expected score/wire fields are stale relative to this measured run and need reconciliation before promotion."
  ]
}
