{
  "schema": "shield.cash/evidence/v1",
  "id": "g1.verifier-envelope-baseline.20260723",
  "gate": "G1",
  "candidate": "bn254-onetx-pf6-a3-r1",
  "claim": "Deterministic arithmetic places the frozen verifier observation against BCHN v29 source limits and the stricter G2 ceilings.",
  "source": {
    "repository": "/home/toorik/Projects/ZK-Proofs/shield.cash",
    "commit": "83e6d164cb8b62abff580b6a6bf9b2b04e46c96a",
    "dirtyPaths": [
      "evidence/G1/envelope-baseline/REPORT.md",
      "evidence/G1/envelope-baseline/calculations.json",
      "evidence/G1/envelope-baseline/observation.json",
      "packages/conformance/baseline-envelope.mjs",
      "packages/conformance/baseline-envelope.test.mjs"
    ]
  },
  "environment": {
    "observedAt": "2026-07-23T13:27:00Z",
    "hardware": {
      "architecture": "x86_64"
    },
    "software": {
      "node": "25.9.0"
    }
  },
  "commands": [
    "node packages/conformance/baseline-envelope.mjs",
    "node packages/conformance/baseline-envelope.mjs | diff -u evidence/G1/envelope-baseline/calculations.json -",
    "node --test packages/conformance/baseline-envelope.test.mjs"
  ],
  "artifacts": [
    {
      "path": "evidence/G1/envelope-baseline/calculations.json",
      "sha256": "cf7aebff37cb954beeae2e16402471f81dc714549c8409f9cbc1c1b1a34b01aa",
      "bytes": 1034
    },
    {
      "path": "evidence/G1/envelope-baseline/REPORT.md",
      "sha256": "5f42ea2cd127cfc41011bed3f6204db98fce7a1e1f7f860365cb4aba4b40443d",
      "bytes": 1271
    }
  ],
  "measurements": {
    "allBytesBudgetRemaining": 40051,
    "wireBudgetRemaining": 40261,
    "maximumUnlockingBytes": 9877,
    "g2UnlockingCeilingBytes": 9500,
    "unlockingInputsOverG2Ceiling": 3,
    "minimumRelayFeeSatoshis": 54739,
    "fixtureFeeShortfallSatoshis": 49739,
    "feeAsPercentOfOneNote": 0.54739,
    "baselineQualifiesForG2": false
  },
  "tests": [
    {
      "name": "generated calculation matches committed JSON",
      "expected": "byte-identical",
      "observed": "byte-identical",
      "pass": true
    },
    {
      "name": "baseline satisfies the stricter G2 unlocking ceiling",
      "expected": true,
      "observed": false,
      "pass": false
    }
  ],
  "verdict": "FAIL",
  "limitations": [
    "The FAIL verdict is for G2 suitability of this exact baseline, not for the mathematical calculation.",
    "Source-recorded limits are not live peer policy evidence.",
    "The remaining-byte figures omit all shield.cash protocol components and are not an envelope projection.",
    "No transaction was constructed, relayed, mined, or executed by this calculation."
  ]
}
